{
  "decision_timing": "single_point",
  "action_type": "binary",
  "n_actions": 2,
  "target": "budgeted_allocation",
  "design_route": "observational_unconfounded",
  "data_source": "observational",
  "outcome_type": "binary",
  "known_propensity": false,
  "estimated_propensity_available": true,
  "overlap_status": "limited",
  "need_interpretability": "high",
  "has_budget_or_capacity_constraint": true,
  "has_cost_or_harm_model": false,
  "language": "r",
  "n_samples": 2500,
  "n_features": 35,
  "high_stakes": false,
  "has_holdout_or_crossfit_plan": true
}
